questionid,text,source,source_url,correct,incorrect1,incorrect2,incorrect3
1,"Also, I don't know where food comes from.",Adventure Time Wiki,https://adventuretime.fandom.com/wiki/Earl_of_Lemongrab/Quotes,4,1,2,3
2,"This cosmic dance of bursting decadence and withheld permissions, twists all our arms collectively, but if sweetness can win, and it can, then I'll still be here tomorrow to high-five you yesterday, my friend. Peace.",Adventure Time,https://www.youtube.com/watch?v=eq2S4g9ZqYM,12,1,2,5
3,Nobody exists on purpose. Nobody belongs anywhere.,Rick and Morty,https://parade.com/tv/rick-and-morty-quotes,7,6,1,11
4,Don't deify the people who leave you.,Rick and Morty,https://parade.com/tv/rick-and-morty-quotes,13,1,8,5
5,The universe is basically an animal. It grazes on the ordinary. It creates infinite idiots just to eat them.,Rick and Morty,https://parade.com/tv/rick-and-morty-quotes,6,2,1,12
6,"One thing that somebody told me is that leadership is a lonely role – some people can do it, and some people can’t.",Kyrie Irving,https://www.elitecolumn.com/kyrie-irving-quotes/,1,8,9,14
7,"Embrace the artistry of your thoughts, for they are the brushes that paint the masterpiece of your reality. Remember, the game is not merely played on the court, but within the vast arena of our minds.",ChatGPT,https://didkyriesayit.s3.us-east-2.amazonaws.com/gpt/7-gpt.png,2,1,9,15
8,"Whether the Earth is flat or curved, it's about the journey, bro. It's about embracing the unknown and expanding our horizons. So let's keep exploring, keep questioning, and let the truth unfold in its own mysterious way. That's how we really grow, man.",ChatGPT,https://didkyriesayit.s3.us-east-2.amazonaws.com/gpt/8-gpt.png,2,1,11,9
9,"C'mon now puppeteers...there's no guilt that I feel, I'm the only player that has to deal with this.",Kyrie Irving,https://twitter.com/davidearly/status/1492717989438885888,1,9,15,16
10,"They let us get two, so don't let us get another one.",Jaylen Brown,https://www.reddit.com/r/nba/comments/13s19ne/highlight_they_let_us_get_two_so_dont_let_us_get/,9,1,17,5
11,"I just don't like Golden State. I don't like anything to do with them. Draymond talks a lot. Gets away with a lot, too. His game is cool -- with Golden State -- but if you put him anywhere else, you're not going to know who Draymond is.",Dillon Brooks,https://www.espn.com/nba/story/_/id/35769523/dillon-brooks-wants-stay-mad,17,1,18,19
12,"For what I've known for many years and what I've been taught is that the Earth is round…can you really think of us rotating around the sun, and all planets align, rotating in specific dates, being perpendicular with what's going on with these 'planets' and stuff like this.",Kyrie Irving,https://www.esquire.com/sports/news/a53264/kyrie-irving-flat-earth/,1,2,20,21
13,I think it’s good to question a lot of things. I’m not entirely convinced that dinosaurs existed.,JJ Redick,https://vendettasportsmedia.com/j-j-redick-kyrie-irving-arent-sure-dinosaurs-really-existed/,20,1,16,8
14,"Actually, throughout my life, my two greatest assets have been mental stability and being, like, really smart.",Donald Trump,https://www.theguardian.com/us-news/2018/jan/06/donald-trump-tweets-mental-stability-fire-and-fury-michael-wolff,8,1,22,6
15,If newborn babies could speak they would be the most intelligent beings on Planet Earth.,Jaden Smith,https://twitter.com/jaden/status/378297797100851200?lang=en,11,1,3,21
16,"There is a certain aspect of life in which I want to tell people about, which is this true journey of really becoming a complete individual and total freedom of thought.",Kyrie Irving,https://www.yahoo.com/news/guys-kyrie-irving-just-wants-open-conversation-flat-earth-140048217.html,1,11,5,24
17,"Science is great and all, but I've always felt there's more to it than just equations and theories. I trust in something deeper—the inner voice, the gut feeling that guides us.",ChatGPT,https://didkyriesayit.s3.us-east-2.amazonaws.com/gpt/17-gpt.png,2,1,15,8
18,My dream doesn’t exist in the future. It lies in the past. That’s the only place it exists.,Sasuke,https://www.reddit.com/r/Naruto/comments/i8bpjf/my_dream_doesnt_exist_in_the_future_it_lies_in/,23,1,11,25
19,I have long since closed my eyes... My only goal is in the darkness.,Sasuke,https://www.reddit.com/r/Naruto/comments/vjhfzh/what_episodemoment_does_sasuke_say_his_famous/,23,24,1,15
20,"This is not even a conspiracy. The Earth is flat. The Earth is flat. The Earth is flat, All these things that particular groups, I won’t even pinpoint one group, that they almost offer up this education. ... They lie to us.",Kyrie Irving,https://www.reuters.com/article/us-basketball-nba-bos-irving-earth/irving-regrets-ever-calling-earth-flat-idUSKCN1MC06V,1,26,19,16
21,They want you to believe the Sun is hot. I urge you to ask yourself “Have they ever touched it?” Think about it.,Jaden Smith,https://www.reddit.com/r/Naruto/comments/vjhfzh/what_episodemoment_does_sasuke_say_his_famous/,11,24,1,15
22,"No one will know where I am in ten years. They'll see me pop up, but they'll be like, ‘Where'd you come from?’ No one will know. No one will know where I'm at. No one will know who I'm with. No one will know what I'm doing.",Jaden Smith,https://www.popsugar.com/celebrity/jaden-smith-interview-gq-magazine-october-2015-38829779,11,1,10,7
23,I’m not gonna say I’m going to be the Lauryn Hill of the game but thats what my best friend told me.,Kyrie Irving,https://thesportsrush.com/nba-news-kyrie-irving-could-be-the-nbas-lauryn-hill-when-nets-star-was-told-by-a-friend-that-he-was-going-to-retire-before-he-hit-his-basketball-peak/,1,10,57,17
24,I have a presence and aura about me that’s very reality-based. It didn’t come in the form of living in this false world and not being able to tell the truth to somebody.,Kyrie Irving,https://www.washingtonpost.com/news/early-lead/wp/2017/09/18/kyrie-irving-really-wasnt-buying-what-espns-first-take-was-selling/,1,15,2,25
25,"If you're very much woke, there's no such thing as distractions.",Kyrie Irving,https://www.yahoo.com/news/kyrie-irving-much-woke-cares-little-lebron-james-personal-feelings-193022930.html,1,26,2,9
26,"The fact that they can make all these movies with alien descriptions. They’re not just going on strictly brainpower and this is just creative things that we’re going to put out to everybody. For what? All to put an alien movie out, for what?",Kyrie Irving,https://www.yahoo.com/news/hey-everyone-just-so-you-know-kyrie-irving-believes-the-earth-is-flat-222937229.html,1,22,26,8
27,Spiritual alchemy is something that I'm huge in. I've been seeing the all-seeing eye for about six months now. Like all the time.,Kyrie Irving,https://www.yahoo.com/news/kyrie-irving-conspiracy-theory-jag-hes-really-now-170552351.html,1,29,2,30
28,I definitely feel closer to the feminine side of the human being than I do the male – or the American idea of what a male is supposed to be. Just watch a beer commercial and you’ll see what I mean.,Kurt Cobain,https://au.rollingstone.com/music/music-news/the-tao-of-kurt-cobain-12-great-quotes-from-the-nirvana-frontman-1596/,31,10,1,16
29,"We have this conflict between good and evil and man and woman because there are people doing evil things to other people for no reason, and I just want to beat the shit out of them. That’s the bottom line.",Kurt Cobain,https://au.rollingstone.com/music/music-news/the-tao-of-kurt-cobain-12-great-quotes-from-the-nirvana-frontman-1596/,31,1,22,32
30,"I love myself better than you. I know it’s wrong, but what should I do?",Kurt Cobain,https://www.youtube.com/watch?v=Zyjh0kFmLE4,31,1,33,5
31,"I’ve been playing basketball a lot longer than some of these people analyzing the game. I’m an actual genius when it comes to this game. If you ask me about basketball, I will talk all day.",Kyrie Irving,https://nba.nbcsports.com/2019/05/03/kyrie-irving-im-an-actual-genius-when-it-comes-to-this-game/,1,34,32,15
32,"Before I got here, connected. They looked like a pretty connected team. After I got here, I’d say sexy because the sex appeal went way up. We’re a good looking team, man.",Spencer Dinwiddie,https://twitter.com/CallieCaplan/status/1530313225560018944,15,16,1,19
33,"Look around you, and all you will see are people the world would be better off without.",Death Note,https://twitter.com/ranAnimeQuotes/status/1477831233648345088,35,1,31,8
34,"When the ball doesn’t go in the rim, the energy of the basketball can translate into the other end as well. That’s just basketball 101. That’s a choice that we have to make.",Kyrie Irving,https://www.boston.com/sports/boston-celtics/2019/05/07/4-thoughts-on-kyrie-irvings-baffling-playoff-performance/,1,20,36,15
35,"They'll give you stuff on the government, geoengineering and chemtrails, and everything else and it just makes you think.",Kyrie Irving,https://www.sbnation.com/2018/1/12/16883156/kyrie-irvings-flat-earth-theory-instagram-research,1,37,38,39
36,"They create separation and class. They create separation in different things that will ultimately spread people apart, and that's the way you control power. That's the way you control power in the whole entire world.",Kyrie Irving,https://sports.yahoo.com/the-many-conspiracy-theories-of-kyrie-irving-brooklyn-nets-antisemitism-231547294.html,1,38,37,39
37,"There is a tyrannical organization calling itself the New World Order…by releasing diseases and viruses and plagues upon us, we then basically get shoved into their system.",Alex Joes,https://twitter.com/NBA_NewYork/status/1570497534539501570,37,1,38,8
38,"It's a lot of weird energy that's in our world that I don't stand for, because, to be honest with you, since I was a kid, I've always had an incredible intuition, and with incredible intuition comes a responsibility.",Kyrie Irving,https://sports.yahoo.com/the-many-conspiracy-theories-of-kyrie-irving-brooklyn-nets-antisemitism-231547294.html,1,9,8,2
39,My post was a post from Alex Jones that he did in the early '90s or late '90s about secret societies in America of occults — and it's true.,Kyrie Irving,https://sports.yahoo.com/the-many-conspiracy-theories-of-kyrie-irving-brooklyn-nets-antisemitism-231547294.html,1,9,11,26
40,"I don't expect understanding from a media conglomerate group that sincerely talks about the game of basketball, and then we talk about religion, as if it's correlative at times, when it's convenient for people to bring it up.",Kyrie Irving,https://sports.yahoo.com/the-many-conspiracy-theories-of-kyrie-irving-brooklyn-nets-antisemitism-231547294.html,1,39,32,20
41,I cannot be antisemitic if I know where I come from.,Kyrie Irving,https://sports.yahoo.com/the-many-conspiracy-theories-of-kyrie-irving-brooklyn-nets-antisemitism-231547294.html,1,42,43,37
42,"The Spiritual War is right at all of our doorsteps, and I humbly ask you to protect your space and energy. Do not let the evils of this world turn you away from GOD. It’s time.",Kyrie Irving,https://www.instagram.com/p/ChxFs7arcmB/?hl=en,1,44,35,45
43,Nobody is hijacking this voice. See if they play this on their TV channels and if they play this actual truth somewhere before you start talking about me and what I am doing with my life.,Kyrie Irving,https://www.espn.com/nba/story/_/id/32397602/kyrie-irving-says-decision-remain-unvaccinated-being-true-feels-good-me,1,43,45,17
44,There were times throughout this process when I was in Brooklyn where I felt very disrespected and my talent. I work extremely hard at what I do.,Kyrie Irving,https://sports.yahoo.com/kyrie-irving-says-times-felt-150015589.html,1,15,29,46
45,"I did what I was supposed to do, took care of my teammates, was incredibly selfless in my approach to leading, and I just want to do all the right things for myself — not to appease anybody that had something negative to say about me or judge me.",Kyrie Irving,https://sports.yahoo.com/kyrie-irving-says-times-felt-150015589.html,1,34,29,32
46,"For me, I’m just trying to be a person who is just being a beacon of hope and light.",Kyrie Irving,https://nba.nbcsports.com/2022/01/17/kyrie-irving-on-getting-vaccinated-ive-made-my-decision-already-and-im-standing-on-it/,1,5,40,43
47,I am honored to be a soldier in Gods Army. Gotta stay poised and serve humanity selflessly.,Kyrie Irving,https://twitter.com/KyrieIrving/status/1641869166494769173?cxt=HHwWqoCzydrTi8ktAAAA,1,2,36,43
48,To my Tribe : “I am because you are.” I pour libations and pray for all of my people today and everyday. I am.,Kyrie Irving,https://twitter.com/KyrieIrving/status/1599837273498845184?cxt=HHwWgICglcTh4bMsAAAA,1,47,48,50
49,"Be still and know. I am All the sacred names of GOD. Don’t just read this, AFFIRM it right now! Say it through your heart. I AM ALL the Sacred names of GOD.",Kyrie Irving,https://twitter.com/KyrieIrving/status/1585712621726334977?cxt=HHwWgoDQ3cvOyoEsAAAA,1,5,44,43
50,"Be still and know, I Am GOD.",Kyrie Irving,https://twitter.com/KyrieIrving/status/1584997565795545088?cxt=HHwWgMDR8e24hf8rAAAA,1,5,50,8
51,"When you’re ready to break free from the media’s control over your subconscious thoughts and emotions, meet me on one of my platforms and let’s chop it up. ",Kyrie Irving,https://twitter.com/KyrieIrving/status/1557762350362423297?cxt=HHwWgsCjndampJ4rAAAA,1,45,32,50
52,"Are you awake? You see everything that’s happening right? F*** what they think. It’s legendary to be different.
",Kyrie Irving,https://twitter.com/KyrieIrving/status/1540418100553818112?cxt=HHwWgIC9kbuG1eAqAAAA,1,50,49,45
53,"When I see my name or my brothers/sisters names getting spun through the media, I refer to all my research about who they are. Their job is to CONTROL PUBLIC PERCEPTION, all while profiting off discussing, discrediting, and disrespecting people’s lives for entertainment.",Kyrie Irving,https://twitter.com/KyrieIrving/status/1519675110193606657?cxt=HHwWgsC90cGd_JYqAAAA,1,50,34,51
54,My mask is off. Now take yours off. No fear.,Kyrie Irving,https://twitter.com/KyrieIrving/status/1438160955192459278?cxt=HHwWnICqgZzxr_UnAAAA,1,43,16,9
55,"Please remove the evil people and their wickedness from our world. 	They’ve had their time, the deception is over! The FiX is up, WaKe up my people.",Kyrie Irving,https://twitter.com/KyrieIrving/status/1367870469257461770?cxt=HHwWlIC0rbm80_slAAAA,1,30,48,52
56,Please keep serving humanity selflessly and being a Light for family/friends and others searching for truth. There’s still more to do in our world. Don’t stop challenging the system. Pioneer your own destiny. ,Kyrie Irving,https://twitter.com/KyrieIrving/status/1649075438398963712?cxt=HHwWgIC8mfjX2OItAAAA,1,2,36,34
57,It’s water under the bridge now. I wish them well. I left them in fourth place. I did what I was supposed to do.,Kyrie Irving,https://www.reddit.com/r/nba/comments/10x57cb/kyrie_irving_on_his_trade_conversations_with/,1,46,29,15
58,"Like some of the things that happened before 9/11, it just was, you think back on history and I'm just like, man. They've gotten it to the point, and of course people will be like 'who's ""they""' but, like, everyone that controls us.",Kyrie Irving,https://www.businessinsider.com/kyrie-irving-flat-earth-best-quotes-jj-redick-podcast-2018-1,1,2,20,51
59,"They create separation and class. They create separation in different things that will ultimately spread people apart, and that's the way you control power. That's the way you control power in the whole entire world.",Kyrie Irving,https://sports.yahoo.com/the-many-conspiracy-theories-of-kyrie-irving-brooklyn-nets-antisemitism-231547294.html,1,38,43,8
60,"Basketball is more than just a game; it's an art form that allows me to express the depths of my soul. The court is my canvas, and with every dribble, every shot, I paint a masterpiece.",ChatGPT,https://didkyriesayit.s3.us-east-2.amazonaws.com/gpt/60-gpt.png,2,1,24,16
61,"Life, an intricate tapestry woven with the threads of existence, beckons us to traverse its labyrinthine depths. It is an eternal dance, a symphony of choices and experiences, inviting us to unravel the enigma of our purpose.",ChatGPT,https://didkyriesayit.s3.us-east-2.amazonaws.com/gpt/61-gpt.png,2,1,49,53
62,"Every dribble, every pass, every shot becomes an allegory of the human condition, reminding us that greatness is forged through perseverance, creativity, and an unwavering commitment to the pursuit of perfection.",ChatGPT,https://didkyriesayit.s3.us-east-2.amazonaws.com/gpt/62-gpt.png,2,1,44,54
63,"As I approach this temporal rim, I shed the exuberance of my younger self, embracing a profound understanding of the intricacies that define the game. Turning thirty grants the sacred opportunity to discern the nuanced rhythms of life's hardwood, to uncover the sublime artistry that lies beneath the surface.",ChatGPT,https://didkyriesayit.s3.us-east-2.amazonaws.com/gpt/63-gpt.png,2,1,3,29
64,"Like an alchemist transmuting base metals into gold, I transmute the physical into the metaphysical, transcending the limitations of mere mortals. A basketball savant recognizes the interplay of angles, the gravity-defying arcs, and the intricate dance of forces that render the game a masterpiece of mathematical elegance.",ChatGPT,https://didkyriesayit.s3.us-east-2.amazonaws.com/gpt/64-gpt.png,2,1,30,34
65,"As I navigate the intricate corridors of awakening, I transcend the realm of slumber and immerse myself in the depths of profound awareness. Being truly woke means embracing the interwoven tapestry of societal complexities, peeling back the layers of systemic realities, and fearlessly challenging the status quo.",ChatGPT,https://didkyriesayit.s3.us-east-2.amazonaws.com/gpt/65-gpt.png,2,1,9,36
66,"I’m insecure, and I need the validation of strangers to feel whole. So, I need every single racist 12-year-old on the Internet to like me, or I don’t feel complete.",Eric Andre,https://www.complex.com/music/a/seane/eric-andre-vince-staples-conversation-trump-isis-internet-trolls,55,1,2,51
67,Being alone is more painful than getting hurt.,One Piece,https://www.youtube.com/shorts/UGfSdok1VFc,61,43,48,1
68,"I can’t tell if the world is worse now or if we just have more cameras. There are cameras everywhere, so now the world knows how bad the world is. I think we give human beings too much credit. We’re primates, you know.",Eric Andre,https://www.complex.com/music/a/seane/eric-andre-vince-staples-conversation-trump-isis-internet-trolls,55,1,50,56
69,"I think everyone is bi, right? There’s no such thing as sexual orientation, or race, or gender. Those are all obsolete man-made concepts.",Eric Andre,https://www.towleroad.com/2016/08/eric-andre-bisexual/,55,1,42,40
70,"If the crowd is full of assholes, it’s no fun. If the crowd is cool, it’s great.",Eric Andre,https://www.complex.com/music/a/seane/eric-andre-vince-staples-conversation-trump-isis-internet-trolls,55,1,14,56
71,I’m an elderly Jewish lesbian trapped in a 33-year-old nerd’s body.,Eric Andre,https://www.towleroad.com/2016/08/eric-andre-bisexual/,55,1,18,57
72,Do you think Margaret Thatcher had girl power? Do you think she effectively utilized girl power by funneling money into illegal paramilitary death squads in Northern Ireland?,Eric Andre,https://screenrant.com/eric-andre-show-thought-provoking-quotes/#do-you-think-margaret-thatcher-had-girl-power-do-you-think-she-effectively-utilized-girl-power-by-funneling-money-into-illegal-paramilitary-death-squads-in-northern-ireland,55,1,6,37
73,"I rarely would go to therapy, but in therapy I learned that I need to take care of myself. My human needs need to be met first.",Eric Andre,https://meditationlifestyle.com/agent-of-chaos-eric-andre-finds-peace-of-mind/,55,1,38,23
74,"Come, follow me and I will send you out to fish for people.","Jesus Christ, Matthew 4:19","https://bmmchurch.org/blog/matthew-419-and-the-call-to-discipleship/#:~:text=The%20first%20thing%20we're,to%20each%20one%20of%20us.",5,1,12,8
75,"For what shall it profit a man, if he gain the whole world, and suffer the loss of his soul?","Jesus Christ, Mark 8:36","https://quod.lib.umich.edu/cgi/k/kjv/kjv-idx?type=citation&book=Mark&chapno=8&startverse=34&endverse=38#:~:text=Mark.,8%20Verses%2034%20to%2038&text=%5B36%5D%20For%20what%20shall%20it,in%20exchange%20for%20his%20soul%3F",5,1,23,35
76,Fuck Thanksgiving.,Kyrie Irving,https://bleacherreport.com/articles/2807285-kyrie-irving-after-loss-vs-knicks-f-k-thanksgiving,1,34,40,51
77,"I am grateful I am constantly in search for more knowledge about life, the world, and myself. I am learning the purpose I have in this universe. I will only use it for greatness. I look up and look within, there are angels, guiding spirits, and synchronicities all around me.",Kyrie Irving,https://www.reddit.com/r/bostonceltics/comments/b4rz44/kyrie_my_intuitive_truth_i_am_grateful_for_my/,1,2,47,25
78,"There is no concrete information except the information that they're giving us. They're particularly putting you in the direction of what to believe and what not to believe. The truth is right there, you just gotta go searching for it. I've been searching for it for a while.",Kyrie Irving,https://www.usatoday.com/story/sports/nba/allstar/2017/02/18/kyrie-irving-earth-flat-nba-all-star/98090104/,1,2,37,45
79,I’m a dumbass.,Charles Barkley,https://www.youtube.com/watch?v=nieLDV3c83Q,21,1,42,50
80,"I've seen a lot of things that my educational system has said that was real and turned out to be completely fake, so I don't mind going against the grain.",Kyrie Irving,https://www.usatoday.com/story/sports/nba/allstar/2017/02/18/kyrie-irving-earth-flat-nba-all-star/98090104/,1,43,53,54
81,"Human beings have mood swings. You go home and you’re not happy with things or mad about something, that’s a mood swing. It’s OK to be human.",Kyrie Irving,https://thisis50.com/2019/10/31/kyrie-irving-says-he-no-longer-concerns-himself-with-things-he-cant-control/,1,58,2,57
82,"I felt like I was the best option on every team that I played for down the stretch. This is the first time in my career I can look down and be like, ‘That motherfucker can make that shot too.’",Kyrie Irving,https://deadspin.com/kyrie-irving-praises-kevin-durant-as-first-teammate-who-1845243924,1,16,34,29
83,You know this is a fictional reality this whole basketball thing. I’m grateful to be able to play it but this has no effect on my real life at this point.,Kyrie Irving,https://www.youtube.com/watch?v=nXXCSglldiQ,1,29,46,10
84,"That's another root of human struggle is worrying about other people's perceptions of who you are. Why would you ever care about that, you know? I think I fell victim to that in my past, of worrying about things that I can't control.",Kyrie Irving,https://www.youtube.com/watch?v=ffMVTg9VBFM,1,19,36,29
86,"If people understood what words could do to a human being especially where we are in today’s society, they wouldn’t be invested in that.",Kyrie Irving,https://www.youtube.com/watch?v=ffMVTg9VBFM,1,32,36,29
87,"Work on yourself, meditate, write down your goals. Paint, sing, hug your parents, hug your sisters, hug your brothers. Worry about things that matter. Talk with your family, converse about things that are going on in the world so you can help make it a better place.",Kyrie Irving,https://www.youtube.com/watch?v=eDQyvLNC0NM,1,38,59,58
88,I am an OMNIST and I meant no disrespect to anyone’s religious beliefs. The “Anti-Semitic” label that is being pushed on me is not justified and does not reflect the reality or truth I live in everyday. I embrace and want to learn from all walks of life and religions.,Kyrie Irving,https://twitter.com/KyrieIrving/status/1586419512538451968,1,43,45,4
89,"I had to unlearn and relearn. Some of that stuff out there, that propaganda, all that stuff that they falsify or make people these big giants of leaders…spiritual warfare at it’s finest, preying on people…you guys gotta work on yourself.",Kyrie Irving,https://youtu.be/eDQyvLNC0NM?t=1684,1,44,52,59
90,The inner machinations of my mind are an enigma.,Patrick Star,https://www.youtube.com/watch?v=1z-pVZiRjac,3,1,5,14
91,Knowledge can never replace friendship. I prefer to be an idiot!,Patrick Star,https://www.youtube.com/shorts/RF385kvWFb0,3,1,61,60
92,Dumb people are just blissfully unaware of how dumb they are.,Patrick Star,https://www.youtube.com/watch?v=zoCPsOEynaY,3,1,59,33
93,"Being grown up is boring. Besides, I don’t get jazz.",Patrick Star,https://spongebob.fandom.com/wiki/Grandma%27s_Kisses/transcript,3,1,4,8
94,"Absolutely every single one of my actions is intentional. Divine purpose. If your day is full of mindless action, you act without thought.",Andrew Tate,https://twitter.com/tateschronicles/status/1560810138231083010?lang=en,50,1,2,35
95,I can’t become clinically depressed because I don’t believe in it.,Andrew Tate,https://www.news.com.au/entertainment/tv/current-affairs/controversial-influencer-andrew-tate-claims-depression-isnt-real/news-story/ab2bab040bcd1c6e6f96a1d2e348e148,50,1,38,45
96,The masculine perspective is you have to understand that life is war. It’s a war for the female you want. It’s a war for the car you want. It’s a war for the money you want. It’s a war for the status. Masculine life is war.,Andrew Tate,https://twitter.com/AndrewTateOff/status/1608908344013762561?lang=en,50,43,1,51
97,"I called this virus [COVID-19] a hoax from the start and everyone called me crazy… The virus isn’t real. There is a virus, yes. Is it deadly? No. Is shutting down the economy an appropriate response? Absolutely not. Clown world.",Andrew Tate,https://techbriefly.com/2022/11/09/andrew-tate-quotes/,50,1,43,60
